{
  "activity": {
    "commits_30d": 0,
    "contributors_total": 1,
    "issues_closed_30d": 0,
    "issues_opened_30d": 0,
    "prs_merged_30d": 0,
    "prs_opened_30d": 0
  },
  "collected_at": "2026-10-21T08:38:56Z",
  "date": "2026-10-21",
  "errors": [],
  "meta": {
    "archived": false,
    "created_at": "2026-07-06T13:31:29Z",
    "default_branch": "main",
    "fork": false,
    "open_issues": 0,
    "pushed_at": "2026-10-20T08:37:54Z",
    "size_kb": 269
  },
  "popularity": {
    "forks": 0,
    "stars": 0,
    "subscribers": 0,
    "watchers": 0
  },
  "releases": [
    {
      "assets": [],
      "name": "v1.3.0",
      "prerelease": false,
      "published_at": "2026-07-08T16:39:09Z",
      "tag": "v1.3.0"
    }
  ],
  "repo": "biterik/repo-vitals",
  "schema_version": 1,
  "traffic": {
    "clones": {
      "2026-10-07": {
        "count": 7,
        "uniques": 4
      },
      "2026-10-08": {
        "count": 7,
        "uniques": 4
      },
      "2026-10-09": {
        "count": 8,
        "uniques": 5
      },
      "2026-10-10": {
        "count": 20,
        "uniques": 12
      },
      "2026-10-11": {
        "count": 19,
        "uniques": 11
      },
      "2026-10-12": {
        "count": 7,
        "uniques": 4
      },
      "2026-10-13": {
        "count": 7,
        "uniques": 4
      },
      "2026-10-14": {
        "count": 18,
        "uniques": 11
      },
      "2026-10-15": {
        "count": 8,
        "uniques": 5
      },
      "2026-10-16": {
        "count": 8,
        "uniques": 5
      },
      "2026-10-17": {
        "count": 10,
        "uniques": 7
      },
      "2026-10-18": {
        "count": 16,
        "uniques": 9
      },
      "2026-10-19": {
        "count": 16,
        "uniques": 9
      },
      "2026-10-20": {
        "count": 7,
        "uniques": 4
      }
    },
    "paths": [
      {
        "count": 1,
        "path": "/biterik/repo-vitals/blob/main/ARCHITECTURE.md",
        "uniques": 1
      },
      {
        "count": 1,
        "path": "/biterik/repo-vitals/blob/main/CHANGELOG.md",
        "uniques": 1
      },
      {
        "count": 1,
        "path": "/biterik/repo-vitals/blob/main/README.md",
        "uniques": 1
      }
    ],
    "referrers": [
      {
        "count": 2,
        "referrer": "github.com",
        "uniques": 2
      }
    ],
    "views": {
      "2026-10-07": {
        "count": 0,
        "uniques": 0
      },
      "2026-10-08": {
        "count": 0,
        "uniques": 0
      },
      "2026-10-09": {
        "count": 2,
        "uniques": 2
      },
      "2026-10-10": {
        "count": 1,
        "uniques": 1
      },
      "2026-10-11": {
        "count": 0,
        "uniques": 0
      },
      "2026-10-12": {
        "count": 0,
        "uniques": 0
      },
      "2026-10-13": {
        "count": 0,
        "uniques": 0
      },
      "2026-10-14": {
        "count": 0,
        "uniques": 0
      },
      "2026-10-15": {
        "count": 0,
        "uniques": 0
      },
      "2026-10-16": {
        "count": 0,
        "uniques": 0
      },
      "2026-10-17": {
        "count": 0,
        "uniques": 0
      },
      "2026-10-18": {
        "count": 0,
        "uniques": 0
      },
      "2026-10-19": {
        "count": 0,
        "uniques": 0
      },
      "2026-10-20": {
        "count": 0,
        "uniques": 0
      }
    }
  }
}
