{
  "activity": {
    "commits_30d": 21,
    "contributors_total": 1,
    "issues_closed_30d": 0,
    "issues_opened_30d": 0,
    "prs_merged_30d": 0,
    "prs_opened_30d": 0
  },
  "collected_at": "2026-07-15T05:42:43Z",
  "date": "2026-07-15",
  "errors": [],
  "meta": {
    "archived": false,
    "created_at": "2026-07-06T13:31:29Z",
    "default_branch": "main",
    "fork": false,
    "open_issues": 0,
    "pushed_at": "2026-07-14T05:41:38Z",
    "size_kb": 225
  },
  "popularity": {
    "forks": 0,
    "stars": 0,
    "subscribers": 0,
    "watchers": 0
  },
  "releases": [
    {
      "assets": [],
      "name": "v1.3.0",
      "prerelease": false,
      "published_at": "2026-07-08T16:39:09Z",
      "tag": "v1.3.0"
    }
  ],
  "repo": "biterik/repo-vitals",
  "schema_version": 1,
  "traffic": {
    "clones": {
      "2026-06-30": {
        "count": 0,
        "uniques": 0
      },
      "2026-07-01": {
        "count": 0,
        "uniques": 0
      },
      "2026-07-02": {
        "count": 0,
        "uniques": 0
      },
      "2026-07-03": {
        "count": 0,
        "uniques": 0
      },
      "2026-07-04": {
        "count": 0,
        "uniques": 0
      },
      "2026-07-05": {
        "count": 0,
        "uniques": 0
      },
      "2026-07-06": {
        "count": 119,
        "uniques": 47
      },
      "2026-07-07": {
        "count": 13,
        "uniques": 8
      },
      "2026-07-08": {
        "count": 74,
        "uniques": 29
      },
      "2026-07-09": {
        "count": 10,
        "uniques": 5
      },
      "2026-07-10": {
        "count": 10,
        "uniques": 5
      },
      "2026-07-11": {
        "count": 11,
        "uniques": 6
      },
      "2026-07-12": {
        "count": 10,
        "uniques": 5
      },
      "2026-07-13": {
        "count": 9,
        "uniques": 4
      }
    },
    "paths": [
      {
        "count": 8,
        "path": "/biterik/repo-vitals",
        "uniques": 1
      },
      {
        "count": 2,
        "path": "/biterik/repo-vitals/actions",
        "uniques": 1
      },
      {
        "count": 2,
        "path": "/biterik/repo-vitals/blob/main/CITATION.cff",
        "uniques": 1
      },
      {
        "count": 1,
        "path": "/biterik/repo-vitals/actions/runs/28921501650",
        "uniques": 1
      }
    ],
    "referrers": [
      {
        "count": 6,
        "referrer": "github.com",
        "uniques": 1
      },
      {
        "count": 4,
        "referrer": "biterik.github.io",
        "uniques": 1
      }
    ],
    "views": {
      "2026-06-30": {
        "count": 0,
        "uniques": 0
      },
      "2026-07-01": {
        "count": 0,
        "uniques": 0
      },
      "2026-07-02": {
        "count": 0,
        "uniques": 0
      },
      "2026-07-03": {
        "count": 0,
        "uniques": 0
      },
      "2026-07-04": {
        "count": 0,
        "uniques": 0
      },
      "2026-07-05": {
        "count": 0,
        "uniques": 0
      },
      "2026-07-06": {
        "count": 7,
        "uniques": 1
      },
      "2026-07-07": {
        "count": 2,
        "uniques": 1
      },
      "2026-07-08": {
        "count": 4,
        "uniques": 1
      },
      "2026-07-09": {
        "count": 0,
        "uniques": 0
      },
      "2026-07-10": {
        "count": 0,
        "uniques": 0
      },
      "2026-07-11": {
        "count": 0,
        "uniques": 0
      },
      "2026-07-12": {
        "count": 0,
        "uniques": 0
      },
      "2026-07-13": {
        "count": 0,
        "uniques": 0
      }
    }
  }
}
