{
  "activity": {
    "commits_30d": 0,
    "contributors_total": 1,
    "issues_closed_30d": 0,
    "issues_opened_30d": 0,
    "prs_merged_30d": 0,
    "prs_opened_30d": 0
  },
  "collected_at": "2026-10-26T09:02:17Z",
  "date": "2026-10-26",
  "errors": [],
  "meta": {
    "archived": false,
    "created_at": "2026-07-06T13:31:29Z",
    "default_branch": "main",
    "fork": false,
    "open_issues": 0,
    "pushed_at": "2026-10-25T08:29:54Z",
    "size_kb": 279
  },
  "popularity": {
    "forks": 0,
    "stars": 0,
    "subscribers": 0,
    "watchers": 0
  },
  "releases": [
    {
      "assets": [],
      "name": "v1.3.0",
      "prerelease": false,
      "published_at": "2026-07-08T16:39:09Z",
      "tag": "v1.3.0"
    }
  ],
  "repo": "biterik/repo-vitals",
  "schema_version": 1,
  "traffic": {
    "clones": {
      "2026-10-12": {
        "count": 7,
        "uniques": 4
      },
      "2026-10-13": {
        "count": 7,
        "uniques": 4
      },
      "2026-10-14": {
        "count": 18,
        "uniques": 11
      },
      "2026-10-15": {
        "count": 8,
        "uniques": 5
      },
      "2026-10-16": {
        "count": 8,
        "uniques": 5
      },
      "2026-10-17": {
        "count": 10,
        "uniques": 7
      },
      "2026-10-18": {
        "count": 16,
        "uniques": 9
      },
      "2026-10-19": {
        "count": 16,
        "uniques": 9
      },
      "2026-10-20": {
        "count": 7,
        "uniques": 4
      },
      "2026-10-21": {
        "count": 13,
        "uniques": 8
      },
      "2026-10-22": {
        "count": 19,
        "uniques": 11
      },
      "2026-10-23": {
        "count": 9,
        "uniques": 6
      },
      "2026-10-24": {
        "count": 17,
        "uniques": 10
      },
      "2026-10-25": {
        "count": 17,
        "uniques": 10
      }
    },
    "paths": [],
    "referrers": [],
    "views": {
      "2026-10-12": {
        "count": 0,
        "uniques": 0
      },
      "2026-10-13": {
        "count": 0,
        "uniques": 0
      },
      "2026-10-14": {
        "count": 0,
        "uniques": 0
      },
      "2026-10-15": {
        "count": 0,
        "uniques": 0
      },
      "2026-10-16": {
        "count": 0,
        "uniques": 0
      },
      "2026-10-17": {
        "count": 0,
        "uniques": 0
      },
      "2026-10-18": {
        "count": 0,
        "uniques": 0
      },
      "2026-10-19": {
        "count": 0,
        "uniques": 0
      },
      "2026-10-20": {
        "count": 0,
        "uniques": 0
      },
      "2026-10-21": {
        "count": 0,
        "uniques": 0
      },
      "2026-10-22": {
        "count": 0,
        "uniques": 0
      },
      "2026-10-23": {
        "count": 0,
        "uniques": 0
      },
      "2026-10-24": {
        "count": 0,
        "uniques": 0
      },
      "2026-10-25": {
        "count": 0,
        "uniques": 0
      }
    }
  }
}
