{
  "activity": {
    "commits_30d": 0,
    "contributors_total": 1,
    "issues_closed_30d": 0,
    "issues_opened_30d": 0,
    "prs_merged_30d": 0,
    "prs_opened_30d": 0
  },
  "collected_at": "2026-10-13T10:42:09Z",
  "date": "2026-10-13",
  "derived": {
    "clones_last_30d": 420,
    "clones_last_7d": 68,
    "downloads_gained_30d": 0,
    "downloads_total": 0,
    "funnel_30d": {
      "downloads_gained": 0,
      "stars_gained": 0,
      "unique_cloners": 253,
      "unique_visitors": 16
    },
    "history_days": 113,
    "per_30d": {
      "clones": 354.4,
      "downloads_gained": 0.0,
      "stars_gained": 0.0,
      "unique_cloners": 194.9,
      "unique_visitors": 11.4,
      "views": 16.5
    },
    "repo_created_at": "2026-07-06T13:31:29Z",
    "star_forecast": {
      "eta_exponential": null,
      "eta_linear": null,
      "next_milestone": 10,
      "stars_per_day": 0.0
    },
    "stars_gained_30d": 0,
    "stars_gained_7d": 0,
    "stars_now": 0,
    "totals": {
      "clones": 1335,
      "downloads_gained": 0,
      "stars_gained": 0,
      "unique_cloners": 734,
      "unique_visitors": 43,
      "views": 62
    },
    "tracking_days": 113,
    "tracking_since": "2026-06-23",
    "views_last_30d": 16,
    "views_last_7d": 3,
    "views_prev_7d": 2,
    "windows": {
      "30d": {
        "clones": 420,
        "downloads_gained": 0,
        "stars_gained": 0,
        "unique_visitors": 16,
        "views": 16
      },
      "365d": {
        "clones": 1335,
        "downloads_gained": 0,
        "stars_gained": 0,
        "unique_visitors": 43,
        "views": 62
      },
      "90d": {
        "clones": 1057,
        "downloads_gained": 0,
        "stars_gained": 0,
        "unique_visitors": 39,
        "views": 43
      }
    }
  },
  "errors": [],
  "meta": {
    "archived": false,
    "created_at": "2026-07-06T13:31:29Z",
    "default_branch": "main",
    "fork": false,
    "open_issues": 0,
    "pushed_at": "2026-10-12T10:58:22Z",
    "size_kb": 260
  },
  "popularity": {
    "forks": 0,
    "stars": 0,
    "subscribers": 0,
    "watchers": 0
  },
  "releases": [
    {
      "assets": [],
      "name": "v1.3.0",
      "prerelease": false,
      "published_at": "2026-07-08T16:39:09Z",
      "tag": "v1.3.0"
    }
  ],
  "repo": "biterik/repo-vitals",
  "schema_version": 1,
  "traffic": {
    "clones": {
      "2026-09-29": {
        "count": 8,
        "uniques": 5
      },
      "2026-09-30": {
        "count": 21,
        "uniques": 11
      },
      "2026-10-01": {
        "count": 7,
        "uniques": 4
      },
      "2026-10-02": {
        "count": 14,
        "uniques": 8
      },
      "2026-10-03": {
        "count": 17,
        "uniques": 10
      },
      "2026-10-04": {
        "count": 17,
        "uniques": 10
      },
      "2026-10-05": {
        "count": 7,
        "uniques": 4
      },
      "2026-10-06": {
        "count": 16,
        "uniques": 10
      },
      "2026-10-07": {
        "count": 7,
        "uniques": 4
      },
      "2026-10-08": {
        "count": 7,
        "uniques": 4
      },
      "2026-10-09": {
        "count": 8,
        "uniques": 5
      },
      "2026-10-10": {
        "count": 20,
        "uniques": 12
      },
      "2026-10-11": {
        "count": 19,
        "uniques": 11
      },
      "2026-10-12": {
        "count": 7,
        "uniques": 4
      }
    },
    "paths": [
      {
        "count": 1,
        "path": "/biterik/repo-vitals/blob/main/ARCHITECTURE.md",
        "uniques": 1
      },
      {
        "count": 1,
        "path": "/biterik/repo-vitals/blob/main/CHANGELOG.md",
        "uniques": 1
      },
      {
        "count": 1,
        "path": "/biterik/repo-vitals/blob/main/README.md",
        "uniques": 1
      },
      {
        "count": 1,
        "path": "/biterik/repo-vitals/issues",
        "uniques": 1
      },
      {
        "count": 1,
        "path": "/biterik/repo-vitals/pulls",
        "uniques": 1
      }
    ],
    "referrers": [
      {
        "count": 2,
        "referrer": "github.com",
        "uniques": 2
      }
    ],
    "views": {
      "2026-09-29": {
        "count": 0,
        "uniques": 0
      },
      "2026-09-30": {
        "count": 0,
        "uniques": 0
      },
      "2026-10-01": {
        "count": 0,
        "uniques": 0
      },
      "2026-10-02": {
        "count": 1,
        "uniques": 1
      },
      "2026-10-03": {
        "count": 0,
        "uniques": 0
      },
      "2026-10-04": {
        "count": 0,
        "uniques": 0
      },
      "2026-10-05": {
        "count": 0,
        "uniques": 0
      },
      "2026-10-06": {
        "count": 1,
        "uniques": 1
      },
      "2026-10-07": {
        "count": 0,
        "uniques": 0
      },
      "2026-10-08": {
        "count": 0,
        "uniques": 0
      },
      "2026-10-09": {
        "count": 2,
        "uniques": 2
      },
      "2026-10-10": {
        "count": 1,
        "uniques": 1
      },
      "2026-10-11": {
        "count": 0,
        "uniques": 0
      },
      "2026-10-12": {
        "count": 0,
        "uniques": 0
      }
    }
  }
}
