{
  "activity": {
    "commits_30d": 0,
    "contributors_total": 1,
    "issues_closed_30d": 0,
    "issues_opened_30d": 0,
    "prs_merged_30d": 0,
    "prs_opened_30d": 0
  },
  "collected_at": "2026-10-04T09:52:35Z",
  "date": "2026-10-04",
  "errors": [],
  "meta": {
    "archived": false,
    "created_at": "2026-07-06T13:31:29Z",
    "default_branch": "main",
    "fork": false,
    "open_issues": 0,
    "pushed_at": "2026-10-03T09:13:38Z",
    "size_kb": 246
  },
  "popularity": {
    "forks": 0,
    "stars": 0,
    "subscribers": 0,
    "watchers": 0
  },
  "releases": [
    {
      "assets": [],
      "name": "v1.3.0",
      "prerelease": false,
      "published_at": "2026-07-08T16:39:09Z",
      "tag": "v1.3.0"
    }
  ],
  "repo": "biterik/repo-vitals",
  "schema_version": 1,
  "traffic": {
    "clones": {
      "2026-09-20": {
        "count": 8,
        "uniques": 5
      },
      "2026-09-21": {
        "count": 8,
        "uniques": 5
      },
      "2026-09-22": {
        "count": 22,
        "uniques": 13
      },
      "2026-09-23": {
        "count": 19,
        "uniques": 12
      },
      "2026-09-24": {
        "count": 8,
        "uniques": 5
      },
      "2026-09-25": {
        "count": 23,
        "uniques": 16
      },
      "2026-09-26": {
        "count": 10,
        "uniques": 7
      },
      "2026-09-27": {
        "count": 13,
        "uniques": 7
      },
      "2026-09-28": {
        "count": 24,
        "uniques": 15
      },
      "2026-09-29": {
        "count": 8,
        "uniques": 5
      },
      "2026-09-30": {
        "count": 21,
        "uniques": 11
      },
      "2026-10-01": {
        "count": 7,
        "uniques": 4
      },
      "2026-10-02": {
        "count": 14,
        "uniques": 8
      },
      "2026-10-03": {
        "count": 17,
        "uniques": 10
      }
    },
    "paths": [
      {
        "count": 2,
        "path": "/biterik/repo-vitals/blob/main/README.md",
        "uniques": 2
      },
      {
        "count": 1,
        "path": "/biterik/repo-vitals",
        "uniques": 1
      },
      {
        "count": 1,
        "path": "/biterik/repo-vitals/blob/main/.gitignore",
        "uniques": 1
      },
      {
        "count": 1,
        "path": "/biterik/repo-vitals/blob/main/ARCHITECTURE.md",
        "uniques": 1
      },
      {
        "count": 1,
        "path": "/biterik/repo-vitals/blob/main/CHANGELOG.md",
        "uniques": 1
      },
      {
        "count": 1,
        "path": "/biterik/repo-vitals/blob/main/LICENSE",
        "uniques": 1
      },
      {
        "count": 1,
        "path": "/biterik/repo-vitals/blob/main/action.yml",
        "uniques": 1
      },
      {
        "count": 1,
        "path": "/biterik/repo-vitals/blob/main/hub-template/README.md",
        "uniques": 1
      },
      {
        "count": 1,
        "path": "/biterik/repo-vitals/blob/main/pyproject.toml",
        "uniques": 1
      },
      {
        "count": 1,
        "path": "/biterik/repo-vitals/issues",
        "uniques": 1
      }
    ],
    "referrers": [],
    "views": {
      "2026-09-20": {
        "count": 2,
        "uniques": 2
      },
      "2026-09-21": {
        "count": 0,
        "uniques": 0
      },
      "2026-09-22": {
        "count": 1,
        "uniques": 1
      },
      "2026-09-23": {
        "count": 0,
        "uniques": 0
      },
      "2026-09-24": {
        "count": 0,
        "uniques": 0
      },
      "2026-09-25": {
        "count": 0,
        "uniques": 0
      },
      "2026-09-26": {
        "count": 4,
        "uniques": 4
      },
      "2026-09-27": {
        "count": 3,
        "uniques": 3
      },
      "2026-09-28": {
        "count": 0,
        "uniques": 0
      },
      "2026-09-29": {
        "count": 0,
        "uniques": 0
      },
      "2026-09-30": {
        "count": 0,
        "uniques": 0
      },
      "2026-10-01": {
        "count": 0,
        "uniques": 0
      },
      "2026-10-02": {
        "count": 1,
        "uniques": 1
      },
      "2026-10-03": {
        "count": 0,
        "uniques": 0
      }
    }
  }
}
